Title,Cook Time,ServingSize,Ingredients,Cooking Instructions,Image Link,Nutrition Label,Host Link
Air-Fried Carrots with Tahini-Lemon Sauce,20,2 serving(s),"['3 large carrots, peeled and cut into sticks', '1 tablespoon grapeseed oil', '¼ teaspoon ground cumin', '¼ teaspoon ground coriander', '1 pinch salt and ground black pepper to taste', '1 ½ tablespoons plain yogurt', '1 tablespoon tahini', '1 tablespoon lemon juice', '1 pinch garlic powder', '1 pinch cayenne pepper', '1 tablespoon chopped fresh parsley', '1 pinch Aleppo pepper']","['Step 1: Preheat the air fryer to 390 degrees F (200 degrees C).\n', 'Step 2: Toss carrot sticks with oil, cumin, coriander, salt, and pepper in a large bowl.\n', 'Step 3: Transfer to the air fryer basket and set timer for 5 minutes.\n', 'Step 4: Shake the basket and continue cooking until carrots are tender and starting to brown, about 5 minutes more.\n', 'Step 5: Meanwhile, whisk yogurt, tahini, lemon juice, garlic, and cayenne in a small bowl.\n', 'Step 6: Season with salt.\n', 'Step 7: Plate carrots and drizzle the sauce on top.\n', 'Step 8: Garnish with parsley and aleppo flakes.\n']",https://imagesvc.meredithcorp.io/v3/mm/image?url=https%3A%2F%2Fimages.media-allrecipes.com%2Fuserphotos%2F8110857.jpg,"{'calories': '163.9 calories', 'carbohydrateContent': '14.4 g', 'cholesterolContent': '0.7 mg', 'fatContent': '11.5 g', 'fiberContent': '4.2 g', 'proteinContent': '3.2 g', 'saturatedFatContent': '1.4 g', 'sodiumContent': '170.7 mg', 'sugarContent': '6.4 g'}",allrecipes.com
Yakh Dar Behesht (Persian Milk Pudding),80,4 serving(s),"['¾ cup rice flour', '2 cups water', '2 cups milk', '1 cup heavy whipping cream', '¼ cup cornstarch', '¾ cup white sugar', '5 tablespoons rose water', '2 tablespoons crushed pistachios', '2 tablespoons chopped almonds', '1 tablespoon dried rose petals']","['Step 1: Dissolve rice flour in water in a bowl and pour into a saucepan over medium heat.\n', 'Step 2: Whisk milk, cream, and cornstarch in a bowl and pour into the saucepan.\n', 'Step 3: Bring rice flour and milk mixture to a boil.\n', 'Step 4: Add sugar and rose water; reduce heat to low and simmer, stirring constantly, until sugar is dissolved and pudding thickens, about 5 minutes.\n', 'Step 5: Scoop pudding into small serving bowls and garnish with pistachios, almonds, and rose petals.\n', 'Step 6: Place bowls in the refrigerator to cool completely, about 1 hour.\n']",https://www.allrecipes.com/img/misc/og-default.png,"{'calories': '592.2 calories', 'carbohydrateContent': '78 g', 'cholesterolContent': '91.3 mg', 'fatContent': '28.2 g', 'fiberContent': '1.7 g', 'proteinContent': '8.6 g', 'saturatedFatContent': '15.7 g', 'sodiumContent': '94 mg', 'sugarContent': '43.9 g'}",allrecipes.com
Middle Eastern-Style Dolma (Stuffed Vegetables),195,12 serving(s),"['3 pounds ground beef', '3 (6 ounce) cans tomato paste, divided', '¾ cup chopped fresh parsley', '¾ cup chopped green onion', '½ cup unsalted butter, softened', '1 tablespoon salt', '¾ tablespoon ground black pepper', '1 ½ cups uncooked white rice', '1 medium head cabbage, leaves separated', '4 large green bell pepper, chopped', '2 large eggplants', '2 large zucchini, sliced']","['Step 1: Combine ground beef, 2 1/2 cans of tomato paste, parsley, green onion, butter, salt, and pepper in a large bowl.\n', 'Step 2: Before adding uncooked rice, rinse until water runs clear; this keeps the rice from becoming sticky.\n', 'Step 3: Add rice after rinsing and mix contents until blended well.\n', 'Step 4: Bring a pot of lightly salted water to a boil; add cabbage.\n', 'Step 5: Boil until just tender enough to fold, 2 to 3 minutes.\n', 'Step 6: Drain and set aside.\n', 'Step 7: Meanwhile, hollow out bell peppers, eggplants, and zucchini.\n', 'Step 8: Stuff hollowed vegetables with meat mixture.\n', ""Step 9: Set in a large pot (pack vegetables together so there isn't much room in between them).\n"", 'Step 10: Fill cabbage leaves with 3 to 4 tablespoons of leftover meat mixture and set in the pot with the other vegetables.\n', 'Step 11: Pour water in the pot on top of the vegetables until almost covered.\n', 'Step 12: Stir in remaining tomato paste.\n', 'Step 13: Weigh down the food by placing a heavy, heat-proof plate on top.\n', 'Step 14: Bring water to a boil; reduce heat to medium and cover the pot.\n', 'Step 15: Let cook for 1 hour.\n', 'Step 16: Drain half of the water in the pot (leave heavy plate until done cooking) and recover, reducing heat to a simmer, and allow to slow cook for 1 hour more.\n', 'Step 17: Serve warm and enjoy!\n']",https://imagesvc.meredithcorp.io/v3/mm/image?url=https%3A%2F%2Fimages.media-allrecipes.com%2Fuserphotos%2F866253.jpg,"{'calories': '462.2 calories', 'carbohydrateContent': '42.6 g', 'cholesterolContent': '91.4 mg', 'fatContent': '22.2 g', 'fiberContent': '9.7 g', 'proteinContent': '26.2 g', 'saturatedFatContent': '10.4 g', 'sodiumContent': '1007.1 mg', 'sugarContent': '12.6 g'}",allrecipes.com
Falafel Dough Pizza,175,4 serving(s),"['1 cup red lentils', '2 teaspoons oil', '1 onion, quartered', '3 cloves garlic, peeled', '½ bunch fresh parsley', '½ bunch fresh cilantro', '¼ cup chopped green onions', '⅓ cup oil', '1 egg', '½ teaspoon baking powder', '¼ teaspoon ground black pepper', '¼ teaspoon chile powder', '¼ teaspoon ground cumin', '¼ teaspoon ground coriander', 'salt to taste', '1 cup yogurt', '4 teaspoons lemon juice', '1 tablespoon tahini', 'salt to taste', '¾ cup shredded Cheddar cheese', '1 tomato, cubed', '¼ cup sliced olives', '1 tablespoon minced fresh parsley', '2 teaspoons minced green onion']","['Step 1: Place red lentils in a bowl and cover with water.\n', 'Step 2: Let soak until softened, about 2 hours.\n', 'Step 3: Drain.\n', 'Step 4: Preheat oven to 350 degrees F (175 degrees C).\n', 'Step 5: Line a baking sheet with parchment paper and grease with 2 teaspoons oil.\n', 'Step 6: Place lentils in a food processor with onion, garlic, 1/2 bunch parsley, cilantro, and 1/4 cup green onions; pulse until finely ground.\n', 'Step 7: Transfer lentil mixture to a large bowl.\n', 'Step 8: Add 1/3 cup oil, egg, baking powder, black pepper, chile powder, cumin, coriander, and salt; mix until well-blended.\n', 'Step 9: Spread dough to 1/4-inch thickness onto prepared baking sheet.\n', 'Step 10: Bake in the preheated oven until golden and firm, about 15 minutes.\n', 'Step 11: Remove from oven.\n', 'Step 12: Combine yogurt, lemon juice, tahini, and salt in a small bowl; mix well until sauce is smooth.\n', 'Step 13: Layer sauce, Cheddar cheese, tomato, olives, 1 tablespoon parsley, and 2 teaspoons green onion on top of baked dough.\n', 'Step 14: Return to the oven and bake until cheese is melted, about 5 minutes.\n']",https://imagesvc.meredithcorp.io/v3/mm/image?url=https%3A%2F%2Fimages.media-allrecipes.com%2Fuserphotos%2F4558643.jpg,"{'calories': '555.6 calories', 'carbohydrateContent': '41.8 g', 'cholesterolContent': '72.4 mg', 'fatContent': '33.4 g', 'fiberContent': '17 g', 'proteinContent': '24.5 g', 'saturatedFatContent': '9.2 g', 'sodiumContent': '428 mg', 'sugarContent': '8.1 g'}",allrecipes.com
Lentil Balls,45,21 serving(s),"['1 ¾ cups water', '1 cup red lentils', '¾ cup fine bulgur (cracked wheat)', '3 tablespoons olive oil', '7 spring onions, finely chopped, or more to taste', '1 ½ tablespoons tomato paste', '½ bunch parsley, minced', '½ lemon, juiced', '1 ½ teaspoons red pepper flakes', '1 teaspoon ground cumin', '1 teaspoon salt']","['Step 1: Combine water and red lentils in a saucepan; bring to a boil.\n', 'Step 2: Reduce heat and simmer until water is absorbed, about 10 minutes.\n', 'Step 3: Stir in bulgur and remove saucepan from heat.\n', 'Step 4: Cover and let stand until bulgur absorbs the residual moisture, about 5 minutes.\n', 'Step 5: Heat olive oil in a skillet over medium heat.\n', 'Step 6: Cook and stir spring onions until softened, 3 to 5 minutes.\n', 'Step 7: Stir in tomato paste; cook for 2 to 3 minutes.\n', 'Step 8: Combine red lentil mixture and onion mixture in a large bowl.\n', 'Step 9: Add parsley, lemon juice, red pepper flakes, cumin, and salt; knead by hand until evenly distributed.\n', 'Step 10: Shape mixture into small logs or round balls and arrange on a plate.\n', 'Step 11: Cover with plastic wrap to prevent the tops from drying out before serving.\n']",https://www.allrecipes.com/img/misc/og-default.png,"{'calories': '207.8 calories', 'carbohydrateContent': '29.2 g', 'fatContent': '6.8 g', 'fiberContent': '7.5 g', 'proteinContent': '9.6 g', 'saturatedFatContent': '0.9 g', 'sodiumContent': '372.4 mg', 'sugarContent': '1.5 g'}",allrecipes.com
Mast-o-Laboo (Beet Yogurt),115,1 item(s),"['1 pinch white sugar, or to taste', '2 beets, peeled', '1 cup plain yogurt', '1 pinch salt']","['Step 1: Bring a saucepan of water to a boil.\n', 'Step 2: Stir sugar into water to dissolve.\n', 'Step 3: Cook beets in boiling water until tender, about 45 minutes; drain and cool beets completely.\n', 'Step 4: Cut cooled beets into 1/2-inch cubes.\n', 'Step 5: Measure 1/2 cup of beet cubes and reserve remainder for later use.\n', 'Step 6: Stir beets into yogurt in a bowl; season with salt.\n']",https://imagesvc.meredithcorp.io/v3/mm/image?url=https%3A%2F%2Fimages.media-allrecipes.com%2Fuserphotos%2F2746274.jpg,"{'calories': '19.1 calories', 'carbohydrateContent': '2.8 g', 'cholesterolContent': '1.2 mg', 'fatContent': '0.3 g', 'fiberContent': '0.4 g', 'proteinContent': '1.3 g', 'saturatedFatContent': '0.2 g', 'sodiumContent': '37.9 mg', 'sugarContent': '2.4 g'}",allrecipes.com
Instant Pot® Turkish Red Lentil Soup with Aleppo Pepper Oil,40,4 serving(s),"['3 tablespoons salted butter', '1 medium yellow onion, cut into 1/2-inch dice', '1 clove garlic, finely grated', '1 teaspoon olive oil', '1 tablespoon sweet paprika', '½ teaspoon ground cumin', '1 tablespoon tomato paste', '1 cup red lentils', '2 tablespoons long-grain white rice', '1 pinch kosher salt, or to taste', '5 cups water', '3 tablespoons extra-virgin olive oil', '2 teaspoons Aleppo pepper', '1 tablespoon chopped fresh mint, or to taste', '1 lemon, cut into wedges']","['Step 1: Turn on a multi-functional pressure cooker (such as Instant Pot®) and select Saute function.\n', 'Step 2: Melt butter until foamy.\n', 'Step 3: Add onion and cook until soft and translucent, about 5 minutes.\n', 'Step 4: Add garlic and cook until fragrant, about 30 seconds.\n', 'Step 5: Push onion and garlic to one side of the pot and add olive oil.\n', 'Step 6: Toast paprika and cumin for 30 seconds.\n', 'Step 7: Stir in tomato paste.\n', 'Step 8: Add lentils, rice, and salt.\n', 'Step 9: Pour in water and turn off Saute function.\n', 'Step 10: Close and lock the lid.\n', ""Step 11: Select high pressure according to manufacturer's instructions; set timer for 3 minutes.\n"", 'Step 12: Allow 10 to 15 minutes for pressure to build.\n', ""Step 13: Release pressure using the natural-release method according to manufacturer's instructions, about 5 minutes.\n"", 'Step 14: Release remaining pressure using the quick-release method, about 5 minutes.\n', 'Step 15: Unlock and remove the lid.\n', 'Step 16: Adjust seasoning to taste.\n', 'Step 17: Meanwhile, heat extra-virgin olive oil in a small skillet over medium heat, swirling to coat the entire skillet.\n', 'Step 18: Add Aleppo pepper and cook until a few bubbles appear and the oil is bright red.\n', 'Step 19: Remove from heat and set aside.\n', 'Step 20: Ladle soup into bowls, drizzle with Aleppo pepper oil, sprinkle with fresh mint, and serve with lemon wedges.\n']",https://www.allrecipes.com/img/misc/og-default.png,"{'calories': '386.8 calories', 'carbohydrateContent': '36.8 g', 'cholesterolContent': '22.9 mg', 'fatContent': '21.4 g', 'fiberContent': '8.5 g', 'proteinContent': '14 g', 'saturatedFatContent': '7.1 g', 'sodiumContent': '210 mg', 'sugarContent': '2.9 g'}",allrecipes.com
Middle Eastern-Style Marzipan,60,10 serving(s),"['3 cups raw unshelled almonds', '½ teaspoon ground cardamom', '½ teaspoon ground cinnamon', '1 pinch salt', '¼ cup honey, or as needed', ""2 tablespoons confectioners' sugar""]","['Step 1: Place almonds in a large skillet over low heat.\n', 'Step 2: Toast, stirring occasionally, until shells crack open easily, about 30 minutes.\n', 'Step 3: Cool until easily handled, about 15 minutes.\n', 'Step 4: Shell almonds; place in a food processor.\n', 'Step 5: Add cardamom, cinnamon, and salt.\n', 'Step 6: Process, slowly pouring in honey, until marzipan mixture lumps together.\n', 'Step 7: Cut and form marzipan into desired shapes.\n', ""Step 8: Dust with confectioners' sugar before serving.\n""]",https://www.allrecipes.com/img/misc/og-default.png,"{'calories': '278.3 calories', 'carbohydrateContent': '17 g', 'fatContent': '21.6 g', 'fiberContent': '5.1 g', 'proteinContent': '9.1 g', 'saturatedFatContent': '1.7 g', 'sodiumContent': '16.3 mg', 'sugarContent': '10.5 g'}",allrecipes.com
Kesme Helva,90,1 serving(s),"['4 cups all-purpose flour, sifted', ""1 cup confectioners' sugar, sifted"", '7 ounces unsalted butter, melted', '1 teaspoon vanilla extract']","['Step 1: Put flour in a wide saucepan.\n', 'Step 2: Cook and stir over medium heat until fragrant, about 15 minutes.\n', ""Step 3: Don't let it turn yellow.\n"", 'Step 4: Add sugar slowly, mixing well, until combined.\n', 'Step 5: Add melted butter and vanilla to the mixture.\n', 'Step 6: Mix all by a spoon or your hands, but be careful, as it can be very hot, until it has a sand-like consistency.\n', 'Step 7: Transfer to a 9x9-inch pan, pressing down as much as you can.\n', 'Step 8: Cut the mixture into a baklava shape or squares.\n', 'Step 9: Chill until set, 1 to 2 hours.\n', 'Step 10: Serve.\n']",https://imagesvc.meredithcorp.io/v3/mm/image?url=https%3A%2F%2Fimages.media-allrecipes.com%2Fuserphotos%2F398187.jpg,"{'calories': '414 calories', 'carbohydrateContent': '56.3 g', 'cholesterolContent': '46.8 mg', 'fatContent': '18.2 g', 'fiberContent': '1.5 g', 'proteinContent': '5.9 g', 'saturatedFatContent': '11.3 g', 'sodiumContent': '3.7 mg', 'sugarContent': '13.9 g'}",allrecipes.com
Persian Pound Cake,85,1 serving(s),"['cooking spray', '2 cups all-purpose flour', '1 cup almond flour', '2 teaspoons baking powder', '1 teaspoon ground cardamom', '½ teaspoon salt', '2 cups white sugar', '1 (8 ounce) package cream cheese, softened', '½ cup butter, softened', '1 tablespoon rose water, or more to taste', '½ teaspoon vanilla extract', '6 eggs']","['Step 1: Preheat oven to 325 degrees F (165 degrees C).\n', 'Step 2: Grease a large tube pan with cooking spray.\n', 'Step 3: Line with parchment paper; spray parchment paper.\n', 'Step 4: Whisk all-purpose flour, almond flour, baking powder, cardamom, and salt together in a bowl.\n', 'Step 5: Combine sugar, cream cheese, and butter in a bowl; beat with an electric mixer until light and fluffy.\n', 'Step 6: Add rose water and vanilla extract.\n', 'Step 7: Add 1 egg at a time, beating well after each addition.\n', 'Step 8: Beat in flour mixture gradually on low speed until batter is smooth and no lumps remain.\n', 'Step 9: Pour batter into the prepared tube pan.\n', 'Step 10: Bake in the preheated oven until a toothpick inserted into the center comes out clean, 50 to 60 minutes.\n', 'Step 11: Cool in the pan for 15 minutes.\n', 'Step 12: Invert onto a wire rack to cool completely before slicing.\n']",https://www.allrecipes.com/img/misc/og-default.png,"{'calories': '413.6 calories', 'carbohydrateContent': '53 g', 'cholesterolContent': '133.9 mg', 'fatContent': '18.6 g', 'fiberContent': '0.6 g', 'proteinContent': '10.5 g', 'saturatedFatContent': '9.9 g', 'sodiumContent': '324 mg', 'sugarContent': '33.6 g'}",allrecipes.com
Mahallebi,25,8 serving(s),"['5 tablespoons corn flour', '4 cups milk, divided', '1 cup white sugar', 'vanilla extract to taste', '¾ cup heavy cream', '2 cups finely chopped pistachio nuts', '2 cups water', '2 cups white sugar', '1 tablespoon lemon juice', '3 (1 inch) pieces cinnamon sticks']","['Step 1: In a small bowl, stir together corn flour and 1 cup milk.\n', 'Step 2: In a saucepan over high heat, stir together 3 cups milk, sugar, and vanilla.\n', 'Step 3: Bring to a boil.\n', 'Step 4: Stir the corn flour and milk mixture into the saucepan.\n', 'Step 5: Reduce the heat to low, and allow to cool slightly; then stir in cream, stirring constantly until the cream is thickened.\n', 'Step 6: Allow to cool momentarily, then pour into individual bowls or one large serving bowl.\n', 'Step 7: Sprinkle pistachio nuts on top.\n', 'Step 8: Cover, and refrigerate.\n', 'Step 9: To make the syrup, stir together water, sugar, and lemon juice in a saucepan set over high heat.\n', 'Step 10: Bring to a boil.\n', 'Step 11: Place cinnamon sticks in saucepan, and boil about 5 minutes.\n', 'Step 12: Strain liquid, and pour into a bowl.\n', 'Step 13: Allow to cool; cover, and refrigerate.\n', 'Step 14: Serve puddings cold with cold syrup drizzled over the top.\n']",https://www.allrecipes.com/img/misc/og-default.png,"{'calories': '622.9 calories', 'carbohydrateContent': '94.2 g', 'cholesterolContent': '40.3 mg', 'fatContent': '24.8 g', 'fiberContent': '3.5 g', 'proteinContent': '11.3 g', 'saturatedFatContent': '8.4 g', 'sodiumContent': '189.6 mg', 'sugarContent': '83.2 g'}",allrecipes.com
"Halloumi, Watermelon, and Mint Salad",20,6 serving(s),"['½ (8.8 ounce) package halloumi cheese', '1 teaspoon olive oil', '3 cups cubed seeded watermelon', '12 leaves fresh mint, sliced, or more to taste', '1 small onion, thinly sliced']","['Step 1: Break halloumi cheese into small pieces.\n', 'Step 2: Heat olive oil in a skillet over medium heat.\n', 'Step 3: Add halloumi and cook and stir until golden, about 3 minutes.\n', 'Step 4: Toss watermelon cubes, mint leaves, onion slices, and fried halloumi in a salad bowl.\n']",https://imagesvc.meredithcorp.io/v3/mm/image?url=https%3A%2F%2Fimages.media-allrecipes.com%2Fuserphotos%2F9178568.jpg,"{'calories': '99.5 calories', 'carbohydrateContent': '7.4 g', 'cholesterolContent': '15.6 mg', 'fatContent': '6.1 g', 'fiberContent': '0.5 g', 'proteinContent': '5 g', 'saturatedFatContent': '3.2 g', 'sodiumContent': '229.9 mg', 'sugarContent': '5.2 g'}",allrecipes.com
Turkish Pogaça,110,12 serving(s),"['3 teaspoons active dry yeast', '1 ½ teaspoons white sugar', '2 tablespoons warm milk', '1 cup all-purpose flour, or more as needed', '1 cup whole wheat flour', '½ cup warm water, or more as needed', '¼ cup vegetable oil', '½ teaspoon salt', '1 teaspoon salted butter, or as needed', '1 cup crumbled feta cheese', '½ bunch fresh parsley, chopped', '1 teaspoon salt', '½ teaspoon ground black pepper', '½ teaspoon chili powder', '2 tablespoons milk, or as needed', '1 teaspoon poppy seeds, or to taste']","['Step 1: Dissolve yeast and sugar in warm milk in a bowl.\n', 'Step 2: Let stand until yeast softens and begins to form a creamy foam, about 5 minutes.\n', 'Step 3: Combine 1 cup all-purpose flour, whole wheat flour, 1/2 cup water, vegetable oil, salt, and yeast mixture in the bowl of a stand mixer fitted with the hook attachment; knead until pliable and not too sticky.\n', 'Step 4: Add a little flour if too soft, or warm water if too hard.\n', 'Step 5: Cover with a wet cloth and let sit at room temperature for 45 to 50 minutes.\n', 'Step 6: Preheat the oven to 350 degrees F (175 degrees C).\n', 'Step 7: Grease a baking tray with butter.\n', 'Step 8: Mix feta cheese, parsley, salt, pepper, and chili powder together in a bowl until well combined.\n', 'Step 9: Knead dough for 2 minutes.\n', 'Step 10: Divide it into 12 equal portions, and roll each one into a ball.\n', 'Step 11: Use your hands or a rolling pin to flatten each ball into a 2- to 3-inch circle.\n', 'Step 12: Add a spoon of cheese filling in the middles and fold the edges upward like a bundle, pressing to secure.\n', 'Step 13: Place on the prepared baking try, folded-sides down.\n', 'Step 14: Brush with milk and sprinkle with poppy seeds.\n', 'Step 15: Bake on the top rack of the preheated oven until golden, 30 to 32 minutes.\n']",https://imagesvc.meredithcorp.io/v3/mm/image?url=https%3A%2F%2Fimages.media-allrecipes.com%2Fuserphotos%2F8064909.jpg,"{'calories': '180.6 calories', 'carbohydrateContent': '17.5 g', 'cholesterolContent': '20 mg', 'fatContent': '9.9 g', 'fiberContent': '1.9 g', 'proteinContent': '6.1 g', 'saturatedFatContent': '4.2 g', 'sodiumContent': '533.7 mg', 'sugarContent': '1.7 g'}",allrecipes.com
Thyme Sekanjabin Sherbet,35,1 serving(s),"['2 tablespoons chopped fresh thyme', '1 cup boiling water', '3 tablespoons sekanjabin syrup', 'ice cubes']","['Step 1: Put thyme in a bowl and top with boiling water; steep for at least 30 minutes.\n', 'Step 2: Strain into a glass and mix sekanjabin syrup into thyme-infused water.\n', 'Step 3: Add ice.\n']",https://imagesvc.meredithcorp.io/v3/mm/image?url=https%3A%2F%2Fimages.media-allrecipes.com%2Fuserphotos%2F3660592.jpg,"{'calories': '103.2 calories', 'carbohydrateContent': '25.8 g', 'fatContent': '0.1 g', 'fiberContent': '0.7 g', 'proteinContent': '0.3 g', 'sodiumContent': '15 mg'}",allrecipes.com
Basmati with Toasted Noodles,30,3 item(s),"['1 cup uncooked basmati rice, rinsed and drained', '2 cups water', '½ teaspoon salt', '2 tablespoons olive oil', '½ (8 ounce) package uncooked fideo noodles', '½ cup water', '¼ cup chopped fresh parsley']","['Step 1: Bring the basmati rice, 2 cups of water, and salt to a boil in a saucepan over high heat.\n', 'Step 2: Reduce heat to medium-low, cover, and simmer until the rice is tender, and the liquid has been absorbed, 20 to 25 minutes.\n', 'Step 3: Meanwhile, heat olive oil in a large skillet over medium-high heat.\n', 'Step 4: Sprinkle the fideo noodles into the skillet in a thin layer, and gently cook and stir, turning the noodles frequently, until they fry to a rust-brown color.\n', 'Step 5: Pour 1/2 cup of water into the noodles, and bring to a boil.\n', 'Step 6: Reduce heat to a simmer, and cook until noodles are tender and water has absorbed, 5 to 8 minutes.\n', 'Step 7: Gently fluff the cooked basmati rice with a fork, and lightly fold in the cooked fideo and parsley.\n', 'Step 8: Add salt to taste.\n']",https://imagesvc.meredithcorp.io/v3/mm/image?url=https%3A%2F%2Fimages.media-allrecipes.com%2Fuserphotos%2F856068.jpg,"{'calories': '219.7 calories', 'carbohydrateContent': '38.8 g', 'fatContent': '5.2 g', 'fiberContent': '0.9 g', 'proteinContent': '5 g', 'saturatedFatContent': '0.8 g', 'sodiumContent': '199.2 mg', 'sugarContent': '0.9 g'}",allrecipes.com
Chelo Kabob (Persian Rice with Chicken Kabob),70,12 serving(s),"['2 pounds ground chicken', '1 small onion, diced', '2 teaspoons ground black pepper', '1 teaspoon salt, or more to taste', '¾ teaspoon ground turmeric, divided', '½ teaspoon saffron, divided', '⅛ teaspoon cayenne pepper', '2 tablespoons warm water', '3 cups water', '2 cardamom pods, bruised', '2 cups long-grain basmati rice', '3 tablespoons butter, divided', '4 medium tomatoes, cut lengthwise into quarters', '1 medium onion, chopped']","['Step 1: Combine chicken, diced onion, black pepper, salt, 1/4 teaspoon turmeric, 1/4 teaspoon saffron, and cayenne in a bowl.\n', 'Step 2: Shape mixture into long, sausage-like kabob shapes, or shape around skewers and put aside in the refrigerator.\n', 'Step 3: Put the leftover saffron minus a pinch in 2 tablespoons warm water so that it lets out its color.\n', 'Step 4: Bring 3 cups water and cardamom pods to a boil; add rice, reduce heat, and let simmer until tender and water has been absorbed, 20 to 25 minutes, making sure not to overcook or undercook.\n', 'Step 5: Drain out any remaining starch water.\n', 'Step 6: Place a pot over low heat.\n', 'Step 7: Add 1 tablespoon butter, remaining turmeric, and reserved pinch of saffron; saute a bit then add the rice on top to dry out the excess water.\n', 'Step 8: Drizzle the saffron water on top and add 1 tablespoon butter.\n', 'Step 9: Cover and let simmer until the rice is fluffy, about 5 minutes.\n', 'Step 10: Melt remaining butter in a skillet over medium-high heat.\n', 'Step 11: Fry kabobs in the hot oil until they are no longer pink in the centers, 5 to 7 minutes, flipping as needed.\n', 'Step 12: Place tomatoes and chopped onion on top and cover.\n', 'Step 13: Cook until tomatoes soften and release their juices (this helps it from getting too dry), about 5 minutes.\n', 'Step 14: Serve with rice.\n']",https://www.allrecipes.com/img/misc/og-default.png,"{'calories': '468.7 calories', 'carbohydrateContent': '56 g', 'cholesterolContent': '103 mg', 'fatContent': '8.7 g', 'fiberContent': '2.3 g', 'proteinContent': '40.9 g', 'saturatedFatContent': '4.5 g', 'sodiumContent': '536.4 mg', 'sugarContent': '3.6 g'}",allrecipes.com
