Title,Cook Time,ServingSize,Ingredients,Cooking Instructions,Image Link,Nutrition Label,Host Link
Chicken Shawarma Marinade,250,4 serving(s),"['1 pound boneless, skinless chicken breast halves, sliced into thin strips', '½ cup Greek yogurt', '1 tablespoon fresh or jarred minced garlic', '1 tablespoon lemon juice', '½ teaspoon ground cinnamon', '½ teaspoon dried oregano', '½ teaspoon salt', '¼ teaspoon ground nutmeg', '¼ teaspoon ground cloves']","['Step 1: Combine chicken, Greek yogurt, garlic, lemon juice, cinnamon, oregano, salt, nutmeg, and cloves in a resealable plastic container or bag.\n', 'Step 2: Shake until ingredients are evenly combined and chicken is well coated.\n', 'Step 3: Refrigerate at least 4 hours, up to overnight.\n', 'Step 4: Discard excess marinade and cook the chicken as desired when ready to make sandwiches or wraps.\n']",https://imagesvc.meredithcorp.io/v3/mm/image?url=https%3A%2F%2Fimages.media-allrecipes.com%2Fuserphotos%2F9354680.jpg,"{'calories': '162.6 calories', 'carbohydrateContent': '2.1 g', 'cholesterolContent': '70.2 mg', 'fatContent': '5.3 g', 'fiberContent': '0.3 g', 'proteinContent': '25.2 g', 'saturatedFatContent': '2.1 g', 'sodiumContent': '363.7 mg', 'sugarContent': '1.2 g'}",allrecipes.com
Lebanese Fattoush (Bread Salad),26,4 serving(s),"['2 pita bread', '1 head romaine lettuce, chopped', '4 radishes, diced', '1 English cucumber, sliced', '1 tomato, diced', '3 green onions, chopped', '2 cloves garlic, crushed', '½ cup chopped fresh parsley', '¼ cup chopped fresh mint', 'salt and ground black pepper to taste', '¼ cup lemon juice', '¼ cup olive oil', '1 tablespoon ground sumac']","['Step 1: Preheat oven to 350 degrees F (175 degrees C).\n', 'Step 2: Place pita bread on a baking sheet.\n', 'Step 3: Bake in the preheated oven until the bread is a light brown, 5 to 7 minutes.\n', 'Step 4: Remove from the oven and allow to cool, 1 to 2 minutes.\n', 'Step 5: Break toasted bread into bite-size pieces.\n', 'Step 6: Combine lettuce, radishes, cucumber, tomato, garlic, green onions, parsley, mint, and salt and pepper together in a bowl; toss until salad is well mixed.\n', 'Step 7: Pour lemon juice, olive oil, and sumac into a salad dressing bottle with a lid; cover and shake until blended.\n', 'Step 8: Add dressing to salad and toss.\n', 'Step 9: Garnish salad with toasted pita.\n']",https://imagesvc.meredithcorp.io/v3/mm/image?url=https%3A%2F%2Fimages.media-allrecipes.com%2Fuserphotos%2F3726318.jpg,"{'calories': '240.6 calories', 'carbohydrateContent': '25.5 g', 'fatContent': '14.4 g', 'fiberContent': '4.6 g', 'proteinContent': '5 g', 'saturatedFatContent': '2 g', 'sodiumContent': '201 mg', 'sugarContent': '4.7 g'}",allrecipes.com
Zereshk Polo (Persian Barberry Rice),170,5 serving(s),"['2 cups uncooked white rice', '2 pinches saffron, divided', '1 pinch white sugar', '1 pound chicken, cut into pieces', '7 tablespoons olive oil, divided', '1 tablespoon advieh (spice blend)', '1 teaspoon garlic paste', '1 teaspoon salt', '1 large potato, sliced', '4 tablespoons butter, divided', '1 cup fresh barberries', '1 tablespoon white sugar']","['Step 1: Soak rice in water to cover for at least 30 minutes.\n', 'Step 2: Meanwhile, place 1 pinch saffron and 1 pinch sugar in a mortar and grind to a fine power.\n', 'Step 3: Transfer to a cup and fill 3/4 full with hot water.\n', 'Step 4: Set aside.\n', 'Step 5: Preheat the oven to 325 degrees F (165 degrees C).\n', 'Step 6: Wash the chicken pieces, pat dry, and place in a deep baking tray.\n', 'Step 7: Coat with 2 tablespoons olive oil, advieh, garlic paste, and remaining saffron.\n', 'Step 8: Cover with aluminum foil.\n', 'Step 9: Bake in the preheated oven until chicken is no longer pink, about 1 hour.\n', 'Step 10: While the chicken is baking, drain the soaked rice, add to a pot, and cover with 4 cups of water.\n', 'Step 11: Add 2 tablespoons of olive oil if desired to stop the grains from sticking to each other and 1 teaspoon salt.\n', 'Step 12: Boil the rice until tender yet firm to the bite, 10 to 15 minutes.\n', 'Step 13: Drain in a colander.\n', 'Step 14: Put the pot back on the stove and add remaining oil.\n', 'Step 15: Lay the sliced potato in the base (to protect the rice, but also to create a delicious edible crust of rice and potato).\n', 'Step 16: Top with the drained rice and cover with a lid.\n', 'Step 17: Cook until the rice begins to steam, 3 to 5 minutes.\n', 'Step 18: Turn the heat to low, and leave to steam, 25 to 30 minutes.\n', 'Step 19: Heat 1/2 of the butter in a frying pan and add barberries.\n', 'Step 20: Saute for 3 to 4 minutes; add 1 tablespoon sugar and 2 tablespoons of the saffron water.\n', 'Step 21: Stir briefly, then remove from heat.\n', 'Step 22: Place a layer of rice on a serving platter, followed by a sprinkling of barberries and a little saffron water.\n', 'Step 23: Keep layering.\n', 'Step 24: Leave some barberries for the top.\n', 'Step 25: Arrange the chicken quarters around or on the top of the platter then spoon the saffron rice and barberries on top.\n']",https://www.allrecipes.com/img/misc/og-default.png,"{'calories': '697.6 calories', 'carbohydrateContent': '78.1 g', 'cholesterolContent': '69.8 mg', 'fatContent': '33.3 g', 'fiberContent': '3.8 g', 'proteinContent': '21.9 g', 'saturatedFatContent': '9.7 g', 'sodiumContent': '627 mg', 'sugarContent': '4.3 g'}",allrecipes.com
Nazook (Sweet Persian Pastry),220,30 serving(s),"['1 cup sour cream, at room temperature', '2 teaspoons white sugar', '1 (.25 ounce) package active dry yeast', '1 egg', '1 tablespoon white vinegar', '1 tablespoon vegetable oil', '3 cups all-purpose flour', '½ cup butter', '1 pound butter, melted', '2 ½ cups white sugar', '2 teaspoons vanilla extract', '4 cups all-purpose flour', '2 egg whites', '2 egg yolks', '1 teaspoon plain yogurt']","['Step 1: Mix 1 cup sour cream, 2 teaspoons sugar, and yeast together in a bowl.\n', 'Step 2: Let stand for 5 minutes.\n', 'Step 3: Mix in egg, vinegar, and oil.\n', 'Step 4: Pour 3 cups flour into a large bowl.\n', 'Step 5: Cut in 1/2 cup butter, working it into the flour until mixture is the consistency of meal.\n', 'Step 6: Stir in sour cream mixture until dough comes together.\n', 'Step 7: Turn dough out onto a floured surface; knead until smooth but still slightly tacky, about 10 minutes.\n', 'Step 8: Cut dough into 4 pieces and wrap each piece in plastic wrap.\n', 'Step 9: Refrigerate until firm, at least 2 hours and up to overnight.\n', 'Step 10: Preheat oven to 350 degrees F (175 degrees C).\n', 'Step 11: Mix melted butter, 2 1/2 cups sugar, and vanilla extract together in a very large bowl to make filling.\n', 'Step 12: Stir in 4 cups flour.\n', 'Step 13: Beat in egg whites.\n', 'Step 14: Roll a piece of dough into an 8x12-inch rectangle on a lightly floured work surface.\n', 'Step 15: Crumble 1/4 of the filling mixture on top, leaving a 1/2-inch border on the long sides.\n', 'Step 16: Cover filling with plastic wrap; flatten out with a rolling pin.\n', 'Step 17: Roll dough into a tight roll, starting with one of the long sides.\n', 'Step 18: Cut roll into 2-inch pieces at a slight angle.\n', 'Step 19: Arrange pieces on a rimmed baking sheet.\n', 'Step 20: Push tops down gently to flatten slightly.\n', 'Step 21: Repeat with remaining 3 pieces of dough and filling.\n', 'Step 22: Whisk egg yolks and yogurt together to make glaze.\n', 'Step 23: Brush glaze over pieces of dough.\n', 'Step 24: Bake in the preheated oven until golden brown, 20 to 30 minutes.\n', 'Step 25: Let cool before serving, about 15 minutes.\n']",https://imagesvc.meredithcorp.io/v3/mm/image?url=https%3A%2F%2Fimages.media-allrecipes.com%2Fuserphotos%2F5111160.jpg,"{'calories': '336.1 calories', 'carbohydrateContent': '39.7 g', 'cholesterolContent': '63.2 mg', 'fatContent': '18.1 g', 'fiberContent': '0.8 g', 'proteinContent': '4.1 g', 'saturatedFatContent': '11 g', 'sodiumContent': '120.2 mg', 'sugarContent': '17.1 g'}",allrecipes.com
Savory Saffron Chicken Polow,105,6 serving(s),"['5 ⅓ cups water', '6 ½ tablespoons olive oil, divided', '16 ounces yellow saffron rice', '2 yellow onions, chopped', '1 clove garlic, minced', '2 pounds skinless, boneless chicken breast halves, cut into cubes', '2 cups chicken broth', '2 (16 ounce) cans chickpeas (garbanzo beans), drained', '4 ounces raisins', '1 tablespoon paprika']","['Step 1: Bring water and 3 1/2 tablespoons olive oil to a boil in a large pot; stir in saffron rice.\n', 'Step 2: Reduce heat to low, cover, and simmer until rice is tender and liquid is absorbed, 20 minutes.\n', 'Step 3: Heat 3 tablespoons olive oil in a skillet over medium-high heat; cook and stir onions and garlic in hot oil until lightly browned and softened, 5 to 10 minutes.\n', 'Step 4: Stir chicken into skillet and cook until seared on all sides; add chicken broth.\n', 'Step 5: Bring broth to a boil, reduce heat to low, cover, and simmer until broth is reduced and chicken is tender, 30 to 45 minutes.\n', 'Step 6: Remove from heat.\n', 'Step 7: Shred chicken using two forks to pull chicken cubes apart.\n', 'Step 8: Preheat oven to 385 degrees F (196 degrees C).\n', 'Step 9: Grease a 9x12-inch baking dish.\n', 'Step 10: Spread 1/2 the rice in a layer on the bottom of the baking dish.\n', 'Step 11: Spoon chicken and onion mixture over rice; spread chickpeas and raisins over chicken mixture.\n', 'Step 12: Top with remaining rice and sprinkle with paprika.\n', 'Step 13: Bake in the preheated oven until liquid is almost completely cooked off and rice is lightly browned at the edges, about 30 minutes.\n', 'Step 14: Cool for 15 minutes before serving.\n']",https://imagesvc.meredithcorp.io/v3/mm/image?url=https%3A%2F%2Fimages.media-allrecipes.com%2Fuserphotos%2F1829930.jpg,"{'calories': '763.5 calories', 'carbohydrateContent': '102.8 g', 'cholesterolContent': '87.8 mg', 'fatContent': '19.9 g', 'fiberContent': '6.8 g', 'proteinContent': '45 g', 'saturatedFatContent': '3.2 g', 'sodiumContent': '1677.8 mg', 'sugarContent': '16 g'}",allrecipes.com
Mahalabia (Lebanese Cardamom Pudding),235,5 serving(s),"['2 cups milk', '6 tablespoons cornstarch', '¼ cup white sugar', '2 drops cardamom-flavored extract', '¼ cup water', '5 tablespoons white sugar', '¼ vanilla bean, split lengthwise and seeds scraped', '¼ cup unsalted pistachios, coarsely chopped', '1 tablespoon dried rose petals, or as needed']","['Step 1: Combine 3/4 cup of the milk and cornstarch in a bowl and stir until smooth.\n', 'Step 2: Pour remaining milk into a pot and stir in sugar and cardamom extract.\n', 'Step 3: Heat over low heat, stirring until sugar is fully dissolved.\n', 'Step 4: Whisk in cornstarch mixture and simmer until thickened, 5 to 10 minutes.\n', 'Step 5: Pour milk mixture into 5 ramekins, cover, and cool to room temperature.\n', 'Step 6: Chill in the refrigerator for at least 3 hours.\n', 'Step 7: Combine water, sugar, and vanilla seeds in a pot and bring to a boil over low heat.\n', 'Step 8: Stir until sugar is dissolved.\n', 'Step 9: Allow syrup to cool.\n', 'Step 10: Sprinkle each serving with pistachios and rose petals.\n', 'Step 11: Drizzle with 1 tablespoon syrup.\n']",https://imagesvc.meredithcorp.io/v3/mm/image?url=https%3A%2F%2Fimages.media-allrecipes.com%2Fuserphotos%2F5369586.jpg,"{'calories': '213.8 calories', 'carbohydrateContent': '38.5 g', 'cholesterolContent': '7.8 mg', 'fatContent': '4.8 g', 'fiberContent': '0.9 g', 'proteinContent': '4.6 g', 'saturatedFatContent': '1.6 g', 'sodiumContent': '41.9 mg', 'sugarContent': '28.3 g'}",allrecipes.com
Kifta and Potatoes with Tahini Sauce,65,4 serving(s),"['1 pound ground lamb', '½ large onion, minced', '½ cup minced fresh parsley', '1 ¼ teaspoons salt', '¾ teaspoon ground allspice', '¾ teaspoon ground black pepper', '2 tablespoons vegetable oil, or as needed', '5 potatoes, peeled and sliced into rounds', 'salt to taste', '2 cloves garlic, crushed and peeled', '2 lemons, juiced', '1 ½ cups water', '½ cup tahini', '1 teaspoon salt', '½ teaspoon ground black pepper', '1 tablespoon olive oil']","['Step 1: Preheat the oven to 400 degrees F (200 degrees C).\n', 'Step 2: Combine lamb, onion, parsley, salt, allspice, and pepper in a large bowl.\n', 'Step 3: Roll meat into 2 1/2-inch long pieces and arrange in a baking pan.\n', 'Step 4: Bake in the preheated oven for 15 minutes.\n', 'Step 5: While meat is cooking, heat vegetable oil in a frying pan over medium heat.\n', 'Step 6: Add potatoes; fry until lightly golden, about 5 minutes.\n', 'Step 7: Set aside on paper towels to drain excess oil.\n', 'Step 8: Sprinkle with salt.\n', 'Step 9: Remove lamb from the oven; drain and discard any fat from meat.\n', 'Step 10: Leave oven on.\n', 'Step 11: Combine garlic, lemon juice, water, tahini, salt, and pepper in a food processor until smooth.\n', 'Step 12: Set tahini sauce aside.\n', 'Step 13: Arrange potatoes on top of lamb in the baking dish and pour tahini sauce on top.\n', 'Step 14: Drizzle with olive oil.\n', 'Step 15: Return the baking pan to the oven.\n', 'Step 16: Bake in the preheated oven until lamb is no longer pink and an instant-read thermometer inserted into the center reads at least 150 degrees F (65 degrees C), about 30 minutes more.\n']",https://imagesvc.meredithcorp.io/v3/mm/image?url=https%3A%2F%2Fimages.media-allrecipes.com%2Fuserphotos%2F1962852.jpg,"{'calories': '719.8 calories', 'carbohydrateContent': '62.2 g', 'cholesterolContent': '75.9 mg', 'fatContent': '42.1 g', 'fiberContent': '12.1 g', 'proteinContent': '31.1 g', 'saturatedFatContent': '10.3 g', 'sodiumContent': '1470.6 mg', 'sugarContent': '3.1 g'}",allrecipes.com
Vegetarian Ghormeh Sabzi,40,4 serving(s),"['¼ cup olive oil, or as needed', '1 large onion, minced', '1 ½ teaspoons ground turmeric', 'soy sauce, or to taste', 'salt and ground black pepper to taste', '2 bunches fresh parsley, chopped', '1 bunch green onions, chopped', '1 bunch fresh cilantro, chopped', '3 ½ tablespoons dried fenugreek leaves (kasoori methi)', '2 cups water, or more as needed', '1 lemon, seeded and cut into 8 wedges', '1 (15 ounce) can kidney beans, rinsed and drained']","['Step 1: Heat olive oil in a pot over medium-high heat.\n', 'Step 2: Saute onion in the hot oil until golden, 7 to 10 minutes.\n', 'Step 3: Mix in turmeric until onion is coated.\n', 'Step 4: Add soy sauce, salt, and pepper.\n', 'Step 5: Stir in parsley, green onions, and cilantro, adjusting soy sauce to taste.\n', 'Step 6: Cook and stir until herbs are sufficiently wilted, 3 to 4 minutes.\n', 'Step 7: Add fenugreek and saute until incorporated.\n', 'Step 8: Pour in water and add lemon slices.\n', 'Step 9: Reduce heat to medium-low and let simmer, uncovered, stirring occasionally and adding more water if necessary, about 20 minutes, adding kidney beans about 10 minutes before serving; sooner than this might make them mushy.\n']",https://www.allrecipes.com/img/misc/og-default.png,"{'calories': '295.2 calories', 'carbohydrateContent': '35.4 g', 'fatContent': '15.1 g', 'fiberContent': '13.8 g', 'proteinContent': '10.9 g', 'saturatedFatContent': '2.1 g', 'sodiumContent': '324.2 mg', 'sugarContent': '3.3 g'}",allrecipes.com
Fatayer (Lebanese Meat Pies),70,16 serving(s),"['1 tablespoon vegetable oil', '2 pounds round steak, cut into small pieces', '2 large onion, chopped', '½ cup snipped fresh parsley', 'salt and ground black pepper to taste', '2 (1 pound) loaves frozen bread dough, thawed', '1 tablespoon butter, melted']","['Step 1: Line a baking sheet with parchment paper.\n', 'Step 2: Heat oil in a large skillet over medium heat.\n', 'Step 3: Add steak pieces, onions, parsley, salt, and pepper and cook until steak is browned on all sides, about 5 minutes.\n', 'Step 4: Remove from the heat.\n', 'Step 5: Pat bread dough on a lightly floured surface into 4- to 5-inch rounds.\n', 'Step 6: Place about 2 tablespoons meat mixture on each dough round.\n', 'Step 7: Fold dough over the mixture to make a triangle.\n', 'Step 8: Pinch the edges of the dough together but make sure to leave the very center of the meat pie unsealed so steam can escape while cooking.\n', 'Step 9: Set on the prepared baking sheet.\n', 'Step 10: Repeat with remaining dough and meat mixture and cover with a clean kitchen towel.\n', 'Step 11: Let rise for 10 minutes.\n', 'Step 12: Preheat the oven to 350 degrees F (175 degrees C).\n', 'Step 13: Bake fatayer in the preheated oven until lightly browned, about 25 minutes.\n']",https://imagesvc.meredithcorp.io/v3/mm/image?url=https%3A%2F%2Fimages.media-allrecipes.com%2Fuserphotos%2F9218186.jpg,"{'calories': '239.1 calories', 'carbohydrateContent': '29.1 g', 'cholesterolContent': '21.5 mg', 'fatContent': '7.1 g', 'fiberContent': '2.7 g', 'proteinContent': '12.8 g', 'saturatedFatContent': '1.8 g', 'sodiumContent': '340.1 mg', 'sugarContent': '3.1 g'}",allrecipes.com
Tomato-Pesto Hummus,10,6 serving(s),"['1 (15 ounce) can chickpeas (garbanzo beans), drained and rinsed', '¼ cup water', '2 tablespoons lime juice', '2 cloves garlic', '1 teaspoon kosher salt', '⅓ cup tahini', '¼ cup tomato paste', '2 tablespoons chopped fresh basil', '1 tablespoon grated Parmesan cheese', '¼ cup extra-virgin olive oil']","['Step 1: Blend chickpeas, water, lime juice, garlic, and kosher salt in a food processor until the chickpeas are broken up, about 20 seconds.\n', 'Step 2: Add tahini, tomato paste, basil, and Parmesan cheese; blend again while streaming olive oil into the mixture until smooth, about 20 seconds more.\n']",https://imagesvc.meredithcorp.io/v3/mm/image?url=https%3A%2F%2Fimages.media-allrecipes.com%2Fuserphotos%2F3256443.jpg,"{'calories': '233.7 calories', 'carbohydrateContent': '16.2 g', 'cholesterolContent': '0.7 mg', 'fatContent': '17.3 g', 'fiberContent': '3.8 g', 'proteinContent': '5.5 g', 'saturatedFatContent': '2.5 g', 'sodiumContent': '574.3 mg', 'sugarContent': '1.5 g'}",allrecipes.com
Lebanese 7 Spices,5,10 serving(s),"['1 tablespoon ground nutmeg', '1 tablespoon ground ginger', '1 tablespoon ground allspice', '1 tablespoon fenugreek seeds', '1 tablespoon freshly ground black pepper', '1 teaspoon ground cloves', '1 teaspoon cinnamon']","['Step 1: Combine nutmeg, ginger, allspice, fenugreek, pepper, cloves, and cinnamon in an airtight container with a lid.\n', 'Step 2: Close and shake to mix spices together.\n', 'Step 3: Store in a cool, dark place.\n']",https://imagesvc.meredithcorp.io/v3/mm/image?url=https%3A%2F%2Fimages.media-allrecipes.com%2Fuserphotos%2F6095290.jpg,"{'calories': '14.6 calories', 'carbohydrateContent': '2.6 g', 'fatContent': '0.5 g', 'fiberContent': '1 g', 'proteinContent': '0.5 g', 'saturatedFatContent': '0.3 g', 'sodiumContent': '2.3 mg', 'sugarContent': '0.3 g'}",allrecipes.com
Tulumba (Deep-Fried Pastry with Syrup),180,25 serving(s),"['2 cups water', '6 tablespoons vegetable oil', '3 ¼ cups all-purpose flour', '1 tablespoon baking powder', '5 large eggs', '2 cups vegetable oil for frying', '5 cups white sugar', '2 ½ cups water']","['Step 1: Bring 2 cups of water and 6 tablespoons oil to a boil in a large pot over high heat.\n', 'Step 2: Remove from heat and stir in flour and baking powder until well combined.\n', 'Step 3: Allow to cool, 15 to 20 minutes.\n', 'Step 4: Add eggs, one by one, and then beat with an electric mixer until mixture is smooth and homogeneous.\n', 'Step 5: Meanwhile, prepare the syrup.\n', 'Step 6: Combine sugar and 2 cups water in a saucepan and bring to a boil over medium-high.\n', 'Step 7: Stir until sugar has dissolved.\n', 'Step 8: Remove from heat and let cool, at least 20 to 30 minutes.\n', 'Step 9: While syrup cools, heat oil in a deep-fryer or large saucepan to 350 degrees F (175 degrees C).\n', 'Step 10: Spoon dough into a tulumba syringe or an icing bag with a special nozzle and pipe small portions of dough into the hot oil.\n', ""Step 11: You can also drop spoonfuls of dough into the hot oil, but then the tulumbas won't have the traditional shape.\n"", 'Step 12: Work in batches and fry tulumbas until golden, 5 to 7 minutes.\n', 'Step 13: Remove to a paper towel-lined plate.\n', 'Step 14: Let cool, about 10 minutes.\n', 'Step 15: Transfer tulumbas to a bowl and pour cooled syrup on top.\n', 'Step 16: Allow to soak for at least 2 hours.\n']",https://imagesvc.meredithcorp.io/v3/mm/image?url=https%3A%2F%2Fimages.media-allrecipes.com%2Fuserphotos%2F3355889.jpg,"{'calories': '242 calories', 'carbohydrateContent': '44.6 g', 'cholesterolContent': '37.2 mg', 'fatContent': '6.2 g', 'fiberContent': '0.4 g', 'proteinContent': '2.9 g', 'saturatedFatContent': '1.1 g', 'sodiumContent': '74 mg', 'sugarContent': '32.1 g'}",allrecipes.com
Arabian Rose Water Pudding (Muhalbiyah),140,8 serving(s),"['3 ½ cups water', '½ cup rose water', '½ cup dry milk powder', '½ cup white sugar', '5 tablespoons cornstarch']","['Step 1: Whisk water, rose water, milk powder, sugar, and cornstarch together in a saucepan until smooth.\n', 'Step 2: Place over medium heat, stirring with a wooden spoon, and cook until it begins to boil; cook at a boil for 2 minutes.\n', 'Step 3: Remove from heat immediately; stir a few times to help it cool.\n', 'Step 4: Divide the mixture between 8 small serving glasses; refrigerate until set, about 2 hours.\n']",https://imagesvc.meredithcorp.io/v3/mm/image?url=https%3A%2F%2Fimages.media-allrecipes.com%2Fuserphotos%2F1010019.jpg,"{'calories': '107.1 calories', 'carbohydrateContent': '20.1 g', 'cholesterolContent': '7.8 mg', 'fatContent': '2.1 g', 'proteinContent': '2.1 g', 'saturatedFatContent': '1.3 g', 'sodiumContent': '33.2 mg', 'sugarContent': '15.6 g'}",allrecipes.com
Hummus I,10,3 item(s),"['2 (15 ounce) cans garbanzo beans, drained', '½ cup roasted tahini', '¼ cup lemon juice', '1 teaspoon grated lemon zest, minced', '2 cloves garlic', '¼ cup packed flat leaf parsley', '¼ cup chopped green onions', 'salt to taste', 'ground black pepper to taste']","['Step 1: Place garbanzo beans, tahini, lemon juice, lemon zest, garlic, parsley, and green onion in the bowl of a food processor.\n', 'Step 2: Blend until smooth, adding water if the mixture is too thick.\n', 'Step 3: Season to taste with salt and pepper.\n']",https://imagesvc.meredithcorp.io/v3/mm/image?url=https%3A%2F%2Fimages.media-allrecipes.com%2Fuserphotos%2F9277149.jpg,"{'calories': '61.6 calories', 'carbohydrateContent': '6.5 g', 'fatContent': '3.4 g', 'fiberContent': '1.6 g', 'proteinContent': '2.3 g', 'saturatedFatContent': '0.5 g', 'sodiumContent': '71.6 mg', 'sugarContent': '0.1 g'}",allrecipes.com
Kookoo Sabzi (Fresh Herb Frittata),65,8 serving(s),"['⅓ cup fresh barberries', '1 bunch Swiss chard, stems removed', '1 bunch fresh parsley, tough stems trimmed', '1 bunch fresh cilantro, tough stems trimmed', '1 bunch fresh dill, tough stems trimmed', '1 bunch green onions, finely chopped', '½ cup walnuts, roughly chopped', '1 clove garlic, chopped', '1 ½ teaspoons kosher salt (such as Diamond Crystal®)', '1 teaspoon dried fenugreek leaves', '1 teaspoon dried tarragon', '½ teaspoon ground turmeric', '¼ teaspoon ground cinnamon', '¼ teaspoon ground saffron', '¼ teaspoon ground Damask rose petals', '¼ teaspoon ground black pepper', '6 large eggs, or more as needed', '⅓ cup olive oil', '2 tablespoons olive oil']","['Step 1: Soak barberries in water to cover for 10 minutes.\n', 'Step 2: Drain.\n', 'Step 3: Pulse Swiss chard, parsley, cilantro, and dill together in a food processor, working in batches, until finely chopped but not mushy.\n', 'Step 4: Place into a large bowl with barberries, walnuts, garlic, salt, fenugreek, tarragon, turmeric, cinnamon, saffron, rose petals, and black pepper.\n', 'Step 5: Stir to combine.\n', 'Step 6: Add 6 eggs and mix well to combine; the batter should have the consistency of thick yogurt or soft serve ice cream.\n', ""Step 7: If it doesn't, add more eggs, 1 at a time, and mix to combine.\n"", 'Step 8: Heat 1/3 cup olive oil in a large (10- or 12-inch) nonstick frying pan over medium heat.\n', 'Step 9: Add batter and spread evenly.\n', 'Step 10: Cover with a lid and cook kookoo until oil starts to bubble along the sides, about 3 minutes.\n', 'Step 11: Cover and cook until it starts to set and the bottom is browned, 12 to 15 minutes.\n', 'Step 12: Cut the kookoo evenly into 4 large pieces and use a wide spatula to flip each piece over, 1 at a time.\n', 'Step 13: Drizzle 2 tablespoons oil in between the cuts, reduce heat to medium-low, and cook, uncovered, until cooked through, about 10 minutes.\n', 'Step 14: Cut into desired pieces and serve warm or at room temperature.\n']",https://imagesvc.meredithcorp.io/v3/mm/image?url=https%3A%2F%2Fimages.media-allrecipes.com%2Fuserphotos%2F7797761.jpg,"{'calories': '238.3 calories', 'carbohydrateContent': '6.7 g', 'cholesterolContent': '139.5 mg', 'fatContent': '21.3 g', 'fiberContent': '2.6 g', 'proteinContent': '7.6 g', 'saturatedFatContent': '3.4 g', 'sodiumContent': '488.3 mg', 'sugarContent': '1.8 g'}",allrecipes.com
